{
  "$schema": "https://json-schema.org/draft/2020-12/schema",
  "$id": "https://schemas.kumwe.org/studio/v1/command.schema.json",
  "title": "Studio command",
  "type": "object",
  "additionalProperties": false,
  "required": [
    "contractVersion",
    "kind",
    "id",
    "type",
    "artifactId",
    "sessionGeneration",
    "baseStateVersion",
    "payload"
  ],
  "properties": {
    "contractVersion": { "$ref": "common.schema.json#/$defs/contractVersion" },
    "kind": { "const": "command" },
    "id": { "$ref": "common.schema.json#/$defs/stableId" },
    "type": { "$ref": "common.schema.json#/$defs/qualifiedName" },
    "artifactId": { "$ref": "common.schema.json#/$defs/stableId" },
    "expectedRevision": { "$ref": "common.schema.json#/$defs/revision" },
    "sessionGeneration": { "$ref": "common.schema.json#/$defs/revision" },
    "baseStateVersion": { "type": "integer", "minimum": 0 },
    "groupId": { "$ref": "common.schema.json#/$defs/stableId" },
    "payload": {
      "type": "object",
      "maxProperties": 1000,
      "propertyNames": { "$ref": "common.schema.json#/$defs/safeJsonMemberName" },
      "additionalProperties": { "$ref": "common.schema.json#/$defs/jsonValue" }
    }
  },
  "allOf": [
    {
      "if": { "properties": { "type": { "const": "studio.command/insert-node" } } },
      "then": { "properties": { "payload": { "$ref": "#/$defs/insertNode" } } }
    },
    {
      "if": { "properties": { "type": { "const": "studio.command/remove-node" } } },
      "then": { "properties": { "payload": { "$ref": "#/$defs/removeNode" } } }
    },
    {
      "if": { "properties": { "type": { "const": "studio.command/restore-node" } } },
      "then": { "properties": { "payload": { "$ref": "#/$defs/restoreNode" } } }
    },
    {
      "if": { "properties": { "type": { "const": "studio.command/move-node" } } },
      "then": { "properties": { "payload": { "$ref": "#/$defs/moveNode" } } }
    },
    {
      "if": { "properties": { "type": { "const": "studio.command/duplicate-node" } } },
      "then": { "properties": { "payload": { "$ref": "#/$defs/duplicateNode" } } }
    },
    {
      "if": { "properties": { "type": { "const": "studio.command/reorder-children" } } },
      "then": { "properties": { "payload": { "$ref": "#/$defs/reorderChildren" } } }
    },
    {
      "if": { "properties": { "type": { "const": "studio.command/set-property" } } },
      "then": { "properties": { "payload": { "$ref": "#/$defs/setProperty" } } }
    },
    {
      "if": { "properties": { "type": { "const": "studio.command/unset-property" } } },
      "then": { "properties": { "payload": { "$ref": "#/$defs/unsetProperty" } } }
    },
    {
      "if": { "properties": { "type": { "const": "studio.command/reset-inherited-property" } } },
      "then": { "properties": { "payload": { "$ref": "#/$defs/resetInheritedProperty" } } }
    },
    {
      "if": { "properties": { "type": { "const": "studio.command/set-size-role" } } },
      "then": { "properties": { "payload": { "$ref": "#/$defs/setSizeRole" } } }
    },
    {
      "if": { "properties": { "type": { "const": "studio.command/unset-size-role" } } },
      "then": { "properties": { "payload": { "$ref": "#/$defs/unsetSizeRole" } } }
    },
    {
      "if": { "properties": { "type": { "const": "studio.command/set-binding" } } },
      "then": { "properties": { "payload": { "$ref": "#/$defs/setBinding" } } }
    },
    {
      "if": { "properties": { "type": { "const": "studio.command/remove-binding" } } },
      "then": { "properties": { "payload": { "$ref": "#/$defs/removeBinding" } } }
    },
    {
      "if": { "properties": { "type": { "const": "studio.command/set-field-value" } } },
      "then": { "properties": { "payload": { "$ref": "#/$defs/setFieldValue" } } }
    },
    {
      "if": { "properties": { "type": { "const": "studio.command/apply-pattern" } } },
      "then": { "properties": { "payload": { "$ref": "#/$defs/applyPattern" } } }
    },
    {
      "if": { "properties": { "type": { "const": "studio.command/add-model-field" } } },
      "then": { "properties": { "payload": { "$ref": "#/$defs/addModelField" } } }
    },
    {
      "if": { "properties": { "type": { "const": "studio.command/batch" } } },
      "then": { "properties": { "payload": { "$ref": "#/$defs/batch" } } }
    }
  ],
  "$defs": {
    "destination": {
      "type": "object",
      "additionalProperties": false,
      "required": ["position"],
      "properties": {
        "parentNodeId": { "$ref": "common.schema.json#/$defs/stableId" },
        "slot": { "$ref": "common.schema.json#/$defs/localName" },
        "position": { "type": "integer", "minimum": 0, "maximum": 100000 }
      },
      "dependentRequired": {
        "parentNodeId": ["slot"],
        "slot": ["parentNodeId"]
      }
    },
    "insertNode": {
      "type": "object",
      "additionalProperties": false,
      "required": ["node", "destination"],
      "properties": {
        "node": { "$ref": "blueprint.schema.json#/$defs/node" },
        "destination": { "$ref": "#/$defs/destination" }
      }
    },
    "removeNode": {
      "type": "object",
      "additionalProperties": false,
      "required": ["nodeId"],
      "properties": {
        "nodeId": { "$ref": "common.schema.json#/$defs/stableId" }
      }
    },
    "restoreNode": {
      "type": "object",
      "additionalProperties": false,
      "required": ["node", "destination"],
      "properties": {
        "node": { "$ref": "blueprint.schema.json#/$defs/node" },
        "destination": { "$ref": "#/$defs/destination" }
      }
    },
    "moveNode": {
      "type": "object",
      "additionalProperties": false,
      "required": ["nodeId", "destination"],
      "properties": {
        "nodeId": { "$ref": "common.schema.json#/$defs/stableId" },
        "destination": { "$ref": "#/$defs/destination" }
      }
    },
    "duplicateNode": {
      "type": "object",
      "additionalProperties": false,
      "required": ["nodeId", "idMap"],
      "properties": {
        "nodeId": { "$ref": "common.schema.json#/$defs/stableId" },
        "destination": { "$ref": "#/$defs/destination" },
        "idMap": {
          "type": "object",
          "minProperties": 1,
          "maxProperties": 5000,
          "propertyNames": { "$ref": "common.schema.json#/$defs/stableId" },
          "additionalProperties": { "$ref": "common.schema.json#/$defs/stableId" }
        }
      }
    },
    "reorderChildren": {
      "type": "object",
      "additionalProperties": false,
      "required": ["order"],
      "properties": {
        "parentNodeId": { "$ref": "common.schema.json#/$defs/stableId" },
        "slot": { "$ref": "common.schema.json#/$defs/localName" },
        "order": {
          "type": "array",
          "minItems": 1,
          "maxItems": 10000,
          "uniqueItems": true,
          "items": { "$ref": "common.schema.json#/$defs/stableId" }
        }
      },
      "dependentRequired": {
        "parentNodeId": ["slot"],
        "slot": ["parentNodeId"]
      }
    },
    "setProperty": {
      "type": "object",
      "additionalProperties": false,
      "required": ["nodeId", "property", "value"],
      "properties": {
        "nodeId": { "$ref": "common.schema.json#/$defs/stableId" },
        "property": { "$ref": "common.schema.json#/$defs/localName" },
        "viewport": { "$ref": "common.schema.json#/$defs/localName" },
        "value": { "$ref": "common.schema.json#/$defs/jsonValue" }
      }
    },
    "unsetProperty": {
      "type": "object",
      "additionalProperties": false,
      "required": ["nodeId", "property"],
      "properties": {
        "nodeId": { "$ref": "common.schema.json#/$defs/stableId" },
        "property": { "$ref": "common.schema.json#/$defs/localName" },
        "viewport": { "$ref": "common.schema.json#/$defs/localName" }
      }
    },
    "resetInheritedProperty": {
      "type": "object",
      "additionalProperties": false,
      "required": ["nodeId", "property"],
      "properties": {
        "nodeId": { "$ref": "common.schema.json#/$defs/stableId" },
        "property": { "$ref": "common.schema.json#/$defs/localName" }
      }
    },
    "setSizeRole": {
      "type": "object",
      "additionalProperties": false,
      "required": ["nodeId", "axis", "role"],
      "properties": {
        "nodeId": { "$ref": "common.schema.json#/$defs/stableId" },
        "axis": { "$ref": "blueprint.schema.json#/$defs/sizeRoleAxis" },
        "role": { "$ref": "common.schema.json#/$defs/localName" },
        "viewport": { "$ref": "common.schema.json#/$defs/localName" }
      }
    },
    "unsetSizeRole": {
      "type": "object",
      "additionalProperties": false,
      "required": ["nodeId", "axis"],
      "properties": {
        "nodeId": { "$ref": "common.schema.json#/$defs/stableId" },
        "axis": { "$ref": "blueprint.schema.json#/$defs/sizeRoleAxis" },
        "viewport": { "$ref": "common.schema.json#/$defs/localName" }
      }
    },
    "setBinding": {
      "type": "object",
      "additionalProperties": false,
      "required": ["nodeId", "port", "binding"],
      "properties": {
        "nodeId": { "$ref": "common.schema.json#/$defs/stableId" },
        "port": { "$ref": "common.schema.json#/$defs/localName" },
        "binding": { "$ref": "blueprint.schema.json#/$defs/binding" }
      }
    },
    "removeBinding": {
      "type": "object",
      "additionalProperties": false,
      "required": ["nodeId", "port"],
      "properties": {
        "nodeId": { "$ref": "common.schema.json#/$defs/stableId" },
        "port": { "$ref": "common.schema.json#/$defs/localName" }
      }
    },
    "setFieldValue": {
      "type": "object",
      "additionalProperties": false,
      "required": ["fieldPath", "value"],
      "properties": {
        "fieldPath": {
          "type": "array",
          "minItems": 1,
          "maxItems": 32,
          "items": { "$ref": "common.schema.json#/$defs/localName" }
        },
        "locale": { "$ref": "common.schema.json#/$defs/locale" },
        "value": { "$ref": "common.schema.json#/$defs/jsonValue" }
      }
    },
    "addModelField": {
      "type": "object",
      "additionalProperties": false,
      "required": ["field"],
      "properties": {
        "field": { "$ref": "content-model.schema.json#/$defs/field" },
        "position": { "type": "integer", "minimum": 0, "maximum": 1000 }
      }
    },
    "applyPattern": {
      "type": "object",
      "additionalProperties": false,
      "required": ["pattern", "nodes", "destination", "idMap"],
      "properties": {
        "pattern": {
          "type": "object",
          "additionalProperties": false,
          "required": ["id", "version", "revision"],
          "properties": {
            "id": { "$ref": "common.schema.json#/$defs/stableId" },
            "version": { "$ref": "common.schema.json#/$defs/semanticVersion" },
            "revision": { "$ref": "common.schema.json#/$defs/revision" }
          }
        },
        "nodes": {
          "type": "array",
          "minItems": 1,
          "maxItems": 100,
          "items": { "$ref": "blueprint.schema.json#/$defs/node" }
        },
        "destination": { "$ref": "#/$defs/destination" },
        "idMap": {
          "type": "object",
          "minProperties": 1,
          "maxProperties": 5000,
          "propertyNames": { "$ref": "common.schema.json#/$defs/stableId" },
          "additionalProperties": { "$ref": "common.schema.json#/$defs/stableId" }
        }
      }
    },
    "batch": {
      "type": "object",
      "additionalProperties": false,
      "required": ["operations"],
      "properties": {
        "operations": {
          "type": "array",
          "minItems": 1,
          "maxItems": 100,
          "items": { "$ref": "#/$defs/batchOperation" }
        }
      }
    },
    "batchOperation": {
      "type": "object",
      "additionalProperties": false,
      "required": ["type", "payload"],
      "properties": {
        "type": {
          "allOf": [
            { "$ref": "common.schema.json#/$defs/qualifiedName" },
            {
              "not": {
                "enum": [
                  "studio.command/apply-pattern",
                  "studio.command/batch",
                  "studio.command/reset-inherited-property"
                ]
              }
            }
          ]
        },
        "payload": {
          "type": "object",
          "maxProperties": 1000,
          "propertyNames": { "$ref": "common.schema.json#/$defs/safeJsonMemberName" },
          "additionalProperties": { "$ref": "common.schema.json#/$defs/jsonValue" }
        }
      },
      "allOf": [
        {
          "if": { "properties": { "type": { "const": "studio.command/insert-node" } } },
          "then": { "properties": { "payload": { "$ref": "#/$defs/insertNode" } } }
        },
        {
          "if": { "properties": { "type": { "const": "studio.command/remove-node" } } },
          "then": { "properties": { "payload": { "$ref": "#/$defs/removeNode" } } }
        },
        {
          "if": { "properties": { "type": { "const": "studio.command/restore-node" } } },
          "then": { "properties": { "payload": { "$ref": "#/$defs/restoreNode" } } }
        },
        {
          "if": { "properties": { "type": { "const": "studio.command/move-node" } } },
          "then": { "properties": { "payload": { "$ref": "#/$defs/moveNode" } } }
        },
        {
          "if": { "properties": { "type": { "const": "studio.command/duplicate-node" } } },
          "then": { "properties": { "payload": { "$ref": "#/$defs/duplicateNode" } } }
        },
        {
          "if": { "properties": { "type": { "const": "studio.command/reorder-children" } } },
          "then": { "properties": { "payload": { "$ref": "#/$defs/reorderChildren" } } }
        },
        {
          "if": { "properties": { "type": { "const": "studio.command/set-property" } } },
          "then": { "properties": { "payload": { "$ref": "#/$defs/setProperty" } } }
        },
        {
          "if": { "properties": { "type": { "const": "studio.command/unset-property" } } },
          "then": { "properties": { "payload": { "$ref": "#/$defs/unsetProperty" } } }
        },
        {
          "if": { "properties": { "type": { "const": "studio.command/set-size-role" } } },
          "then": { "properties": { "payload": { "$ref": "#/$defs/setSizeRole" } } }
        },
        {
          "if": { "properties": { "type": { "const": "studio.command/unset-size-role" } } },
          "then": { "properties": { "payload": { "$ref": "#/$defs/unsetSizeRole" } } }
        },
        {
          "if": { "properties": { "type": { "const": "studio.command/set-binding" } } },
          "then": { "properties": { "payload": { "$ref": "#/$defs/setBinding" } } }
        },
        {
          "if": { "properties": { "type": { "const": "studio.command/remove-binding" } } },
          "then": { "properties": { "payload": { "$ref": "#/$defs/removeBinding" } } }
        },
        {
          "if": { "properties": { "type": { "const": "studio.command/set-field-value" } } },
          "then": { "properties": { "payload": { "$ref": "#/$defs/setFieldValue" } } }
        }
      ]
    }
  }
}
