{
  "contractVersion": "0.1-draft",
  "kind": "command",
  "id": "command-01J5",
  "type": "studio.command/move-node",
  "artifactId": "org.example.blueprints/product-card",
  "expectedRevision": "product-card-r5",
  "sessionGeneration": "session-generation-1",
  "baseStateVersion": 12,
  "payload": {
    "nodeId": "node-price",
    "destination": {
      "parentNodeId": "node-grid",
      "slot": "items",
      "position": 0
    }
  }
}
